{
  "schemaVersion": "1.0",
  "episodeId": "SmokeTest_000",
  "title": "BinB smoke test",
  "status": "draft",
  "accountPhase": "warmup",
  "contentOrigin": "original",
  "pillar": "money_everyday_economics",
  "formatFamily": "data_brief",
  "voice": "af_sarah",
  "musicLane": "money_people_decisions",
  "campaign": null,
  "rights": {
    "musicLicensed": true,
    "visualsOriginal": true,
    "narrationOriginal": true,
    "factsVerified": true
  },
  "sources": [
    {
      "sourceId": "SRC01",
      "url": "https://example.org/budget-study",
      "publisher": "Example Research Institute",
      "title": "Household budgeting behaviour study",
      "publishedDate": "2025-11-02",
      "accessedDate": "2026-07-20",
      "evidenceFile": "sources/budget-study.pdf"
    }
  ],
  "claims": [
    {
      "claimId": "C01",
      "claim": "A majority of new budgets are abandoned within the first week.",
      "sourceId": "SRC01",
      "verified": true,
      "quote": "Most participants stopped tracking within seven days."
    }
  ],
  "scenes": [
    {
      "id": "S01",
      "role": "hook",
      "type": "hook",
      "variant": "statistic",
      "surface": "dark",
      "motion": "measured_reveal",
      "narration": "Smoke test.",
      "claims": [
        "C01"
      ],
      "visual": {
        "eyebrow": "MONEY · HABITS",
        "statistic": "7",
        "statisticSuffix": "DAYS",
        "headline": "smoke test scene",
        "highlightedIndex": 1
      },
      "visualSystem": {
        "lane": "object_metaphor",
        "density": "quiet",
        "seed": "Example_001-S01",
        "material": "grain"
      }
    },
    {
      "id": "S02",
      "role": "evidence",
      "type": "data_proof",
      "variant": "single_value",
      "surface": "dark",
      "motion": "measured_reveal",
      "narration": "One data point.",
      "claims": [
        "C01"
      ],
      "visual": {
        "eyebrow": "WHAT THE DATA SAYS",
        "value": 7,
        "decimals": 0,
        "suffix": "",
        "label": "days before most budgets are abandoned",
        "source": "SOURCE · EXAMPLE RESEARCH INSTITUTE",
        "subtitle": "Tracking stops long before payday."
      },
      "visualSystem": {
        "lane": "evidence_desk",
        "density": "editorial",
        "seed": "Example_001-S03",
        "material": "scan"
      }
    },
    {
      "id": "S03",
      "role": "outcome",
      "type": "outcome",
      "variant": "statement",
      "surface": "orange",
      "motion": "restrained_lift",
      "narration": "One outcome.",
      "visual": {
        "eyebrow": "THE BETTER APPROACH",
        "setup": "Willpower runs out. Systems do not.",
        "outcome": "SYSTEMS",
        "comparison": "> WILLPOWER",
        "question": "DOES YOUR BUDGET FIT YOUR WEEK?",
        "subtitle": "Build the system around real behaviour."
      },
      "visualSystem": {
        "lane": "editorial_type",
        "density": "quiet",
        "seed": "Example_001-S04",
        "material": "paper"
      }
    },
    {
      "id": "S04",
      "role": "closing",
      "type": "closing_brand",
      "variant": "standard",
      "surface": "light",
      "motion": "restrained_lift",
      "narration": "Big ideas.",
      "visual": {
        "tagline": "Big ideas. Briefly.",
        "closingLine": "Design beats discipline."
      },
      "visualSystem": {
        "lane": "editorial_type",
        "density": "quiet",
        "seed": "Example_001-S05",
        "material": "paper"
      }
    }
  ],
  "packaging": {
    "youtubeTitle": "smoke",
    "instagramCaption": "smoke",
    "tiktokCaption": "smoke",
    "hashtags": []
  }
}
